{
  "customer_name": "Mrs Sophie Clarke",
  "offer_reference": "FBS-2026-104777",
  "offer_date": "2026-10-01",
  "offer_expiry_date": "2027-04-01",
  "property_address": "27 Orchard Rise, Hollins Cross, HX7 2LD",
  "mortgage_purpose": "purchase (home mover)",
  "product_name": "2 Year Fixed Mover 85%",
  "repayment_type": "capital and interest",
  "property_value": 350000,
  "loan_amount": 297500,
  "ltv_percent": 85.0,
  "term_years": 35,
  "initial_rate_percent": 5.09,
  "initial_period_months": 24,
  "initial_period_end_date": "2028-11-30",
  "follow_on_rate_percent": 7.49,
  "monthly_payment_initial": 1518.57,
  "monthly_payment_follow_on": 1985.46,
  "total_amount_repayable": 824186.31,
  "product_fee": 1499,
  "product_fee_added_to_loan": false,
  "early_repayment_charges": [
    {
      "year": 1,
      "percent": 3
    },
    {
      "year": 2,
      "percent": 2
    }
  ],
  "overpayment_allowance_percent": 10,
  "contact_phone": "01632 960412"
}