{
  "customer_name": "Ms Priya Raman",
  "offer_reference": "FBS-2026-104381",
  "offer_date": "2026-09-14",
  "offer_expiry_date": "2027-03-14",
  "property_address": "Flat 4, 18 Quarry Lane, Stonebridge, ST4 9QP",
  "mortgage_purpose": "purchase (first-time buyer)",
  "product_name": "2 Year Fixed First Home 90%",
  "repayment_type": "capital and interest",
  "property_value": 285000,
  "loan_amount": 256500,
  "ltv_percent": 90.0,
  "term_years": 30,
  "initial_rate_percent": 4.89,
  "initial_period_months": 24,
  "initial_period_end_date": "2028-10-31",
  "follow_on_rate_percent": 7.49,
  "monthly_payment_initial": 1359.76,
  "monthly_payment_follow_on": 1770.43,
  "total_amount_repayable": 627497.65,
  "product_fee": 0,
  "product_fee_added_to_loan": false,
  "early_repayment_charges": [
    {
      "year": 1,
      "percent": 2
    },
    {
      "year": 2,
      "percent": 1
    }
  ],
  "overpayment_allowance_percent": 10,
  "contact_phone": "01632 960412"
}