{
  "customer_name": "Mr Gareth Lloyd",
  "offer_reference": "FBS-2026-104512",
  "offer_date": "2026-09-22",
  "offer_expiry_date": "2027-03-22",
  "property_address": "Ty Glas, 3 Heol yr Afon, Llanfernant, LF2 6RT",
  "mortgage_purpose": "remortgage",
  "product_name": "5 Year Fixed Remortgage 60%",
  "repayment_type": "capital and interest",
  "property_value": 420000,
  "loan_amount": 210999,
  "ltv_percent": 50.2,
  "term_years": 20,
  "initial_rate_percent": 4.19,
  "initial_period_months": 60,
  "initial_period_end_date": "2031-10-31",
  "follow_on_rate_percent": 7.49,
  "monthly_payment_initial": 1299.84,
  "monthly_payment_follow_on": 1607.25,
  "total_amount_repayable": 367295.28,
  "product_fee": 999,
  "product_fee_added_to_loan": true,
  "early_repayment_charges": [
    {
      "year": 1,
      "percent": 5
    },
    {
      "year": 2,
      "percent": 4
    },
    {
      "year": 3,
      "percent": 3
    },
    {
      "year": 4,
      "percent": 2
    },
    {
      "year": 5,
      "percent": 1
    }
  ],
  "overpayment_allowance_percent": 10,
  "contact_phone": "01632 960412"
}